{
  "$schema": "https://json-schema.org/draft/2020-12/schema",
  "title": "TaskRecipe",
  "type": "object",
  "properties": {
    "artefact_kind": {
      "type": "string"
    },
    "constraints": {
      "type": "array",
      "default": [],
      "items": {
        "type": "string"
      }
    },
    "evidence": {
      "type": "array",
      "default": [],
      "items": {
        "type": "string"
      }
    },
    "goal": {
      "type": "string"
    },
    "steps": {
      "type": "array",
      "items": {
        "$ref": "#/$defs/RecipeStep"
      }
    }
  },
  "additionalProperties": false,
  "required": [
    "goal",
    "artefact_kind",
    "steps"
  ],
  "$defs": {
    "RecipeStep": {
      "oneOf": [
        {
          "type": "object",
          "properties": {
            "arch_id": {
              "type": "string"
            },
            "kind": {
              "type": "string",
              "const": "plan"
            }
          },
          "additionalProperties": false,
          "required": [
            "kind",
            "arch_id"
          ]
        },
        {
          "type": "object",
          "properties": {
            "arch_id": {
              "type": "string"
            },
            "kind": {
              "type": "string",
              "const": "draft"
            }
          },
          "additionalProperties": false,
          "required": [
            "kind",
            "arch_id"
          ]
        },
        {
          "type": "object",
          "properties": {
            "arch_id": {
              "type": "string"
            },
            "kind": {
              "type": "string",
              "const": "judge"
            }
          },
          "additionalProperties": false,
          "required": [
            "kind",
            "arch_id"
          ]
        },
        {
          "type": "object",
          "properties": {
            "drivers": {
              "type": "array",
              "default": [],
              "items": {
                "type": "string"
              }
            },
            "instruction": {
              "type": [
                "string",
                "null"
              ],
              "default": null
            },
            "kind": {
              "type": "string",
              "const": "harness"
            },
            "max_actions": {
              "type": [
                "integer",
                "null"
              ],
              "format": "uint32",
              "default": null,
              "minimum": 0
            },
            "name": {
              "type": "string"
            },
            "timeout_s": {
              "type": [
                "integer",
                "null"
              ],
              "format": "uint64",
              "default": null,
              "minimum": 0
            }
          },
          "additionalProperties": false,
          "required": [
            "kind",
            "name"
          ]
        },
        {
          "type": "object",
          "properties": {
            "kind": {
              "type": "string",
              "const": "approve"
            }
          },
          "additionalProperties": false,
          "required": [
            "kind"
          ]
        },
        {
          "type": "object",
          "properties": {
            "kind": {
              "type": "string",
              "const": "release"
            },
            "to_dir": {
              "type": "string"
            }
          },
          "additionalProperties": false,
          "required": [
            "kind",
            "to_dir"
          ]
        }
      ]
    }
  }
}
