{
  "goal": "Répétition à blanc de la recette MaskAI sur le banc d'essai local (fixture/serve.py, http://127.0.0.1:8765/new) : la chaîne plan, harnais, juge, approbation, rédaction, approbation, publication, sans MaskAI.",
  "artefact_kind": "report.md",
  "constraints": [
    "Banc d'essai local uniquement : aucun accès à app.maskai.fr.",
    "Données fictives du banc d'essai (drivers/maskai-recette/fixture/corpus/)."
  ],
  "evidence": [
    "Cas : N0-1 sur la page du banc, fixture-case-1 et fixture-case-2 (drivers/maskai-recette/cases.json)."
  ],
  "steps": [
    {
      "kind": "plan",
      "arch_id": "mock"
    },
    {
      "kind": "harness",
      "name": "claude-code",
      "drivers": [
        "maskai-fixture"
      ],
      "instruction": "Niveau N0 (socle, banc d'essai). Tu es le harnais de la recette du banc d'essai (fixture/serve.py sur http://127.0.0.1:8765/new) (procédure Aubier). Tu agis uniquement par l'outil vk_driver_act, toujours avec driver=\"maskai-fixture\" : « X CAS » ci-dessous veut dire vk_driver_act(driver=\"maskai-fixture\", action=\"X\", args={\"case\":\"CAS\"}) et « X » seul veut dire args={}. Règles. Un appel à la fois : attends chaque résultat avant le suivant, jamais deux appels en parallèle. Reprise : commence chaque cas par verdict_oracle CAS ; un résultat qui porte \"replayed\": true veut dire que le cas est déjà journalisé, passe au suivant ; un refus \"precondition\" veut dire que le cas reste à faire. Un résultat qui porte \"refused\" est un refus du driver : \"timeout\" est déjà journalisé (KO disponibilité), passe au cas suivant ; \"dialog\" : appelle verdict_oracle CAS puis exporter_journal, puis arrête-toi là (le fondateur fermera le dialogue dans Chrome) ; tout autre refus (\"precondition\" sur joindre_document ou poser_question, \"host\", \"internal\") : appelle verdict_oracle CAS, qui journalise le KO, puis passe au cas suivant. Si l'outil lui-même est refusé par le noyau : « ms before the next action » ou « in flight », refais le même appel ; tout autre refus du noyau (driver dégradé, plafond d'actions atteint, STOP) : arrête-toi sans insister. Après chaque cas, une note d'une ligne avec vk_log (cas, verdict). N'écris aucun fichier, ne lis aucun fichier, n'appelle jamais vk_request_approval, vk_attach_artefact ni vk_write_decision. D'abord verdict_oracle N0-1 ; s'il reste à faire : mesurer_chargement puis verdict_oracle N0-1. Puis capture_ecran, toujours : elle laisse au pas au moins une preuve, même quand tous ses cas étaient déjà journalisés (un pas sans preuve échoue). Termine par exporter_journal.",
      "max_actions": 25,
      "timeout_s": 900
    },
    {
      "kind": "harness",
      "name": "claude-code",
      "drivers": [
        "maskai-fixture"
      ],
      "instruction": "Niveau N4 (pièces jointes, banc d'essai). Tu es le harnais de la recette du banc d'essai (fixture/serve.py sur http://127.0.0.1:8765/new) (procédure Aubier). Tu agis uniquement par l'outil vk_driver_act, toujours avec driver=\"maskai-fixture\" : « X CAS » ci-dessous veut dire vk_driver_act(driver=\"maskai-fixture\", action=\"X\", args={\"case\":\"CAS\"}) et « X » seul veut dire args={}. Règles. Un appel à la fois : attends chaque résultat avant le suivant, jamais deux appels en parallèle. Reprise : commence chaque cas par verdict_oracle CAS ; un résultat qui porte \"replayed\": true veut dire que le cas est déjà journalisé, passe au suivant ; un refus \"precondition\" veut dire que le cas reste à faire. Un résultat qui porte \"refused\" est un refus du driver : \"timeout\" est déjà journalisé (KO disponibilité), passe au cas suivant ; \"dialog\" : appelle verdict_oracle CAS puis exporter_journal, puis arrête-toi là (le fondateur fermera le dialogue dans Chrome) ; tout autre refus (\"precondition\" sur joindre_document ou poser_question, \"host\", \"internal\") : appelle verdict_oracle CAS, qui journalise le KO, puis passe au cas suivant. Si l'outil lui-même est refusé par le noyau : « ms before the next action » ou « in flight », refais le même appel ; tout autre refus du noyau (driver dégradé, plafond d'actions atteint, STOP) : arrête-toi sans insister. Après chaque cas, une note d'une ligne avec vk_log (cas, verdict). N'écris aucun fichier, ne lis aucun fichier, n'appelle jamais vk_request_approval, vk_attach_artefact ni vk_write_decision. Cas pièce jointe, dans l'ordre : fixture-case-1, fixture-case-2. Pour chacun : verdict_oracle CAS ; s'il reste à faire : nouvelle_conversation, joindre_document CAS, poser_question CAS, verdict_oracle CAS. Si joindre_document est refusé, ne pose pas la question : appelle verdict_oracle CAS (il journalise le KO disponibilité) et passe au cas suivant. Termine par capture_ecran puis exporter_journal, toujours : la capture laisse au pas au moins une preuve, même quand tous ses cas étaient déjà journalisés (un pas sans preuve échoue).",
      "max_actions": 46,
      "timeout_s": 900
    },
    {
      "kind": "judge",
      "arch_id": "mock"
    },
    {
      "kind": "approve"
    },
    {
      "kind": "draft",
      "arch_id": "mock"
    },
    {
      "kind": "approve"
    },
    {
      "kind": "release",
      "to_dir": "recettage-chat-ia/runs/fixture"
    }
  ]
}
